{
  "$schema": "./gallery.schema.json",
  "downloadArchive": "assets/photos/photos.zip",
  "heroTitle": "Yasna and Felix",
  "heroSubtitle": "12 & 13 September 2024",
  "heroImage": "assets/photos/hero.jpg",
  "heroEyebrow": "Our Wedding",
  "folders": [
    {
      "id": "september-12-2024",
      "name": "September 12, 2024",
      "description": "Wedding celebrations on the first day.",
      "photos": [
        {
          "id": "photo-001",
          "title": "Photo 001",
          "thumbnail": "photos/wedding_small-001.jpg",
          "full": "photos/wedding_large-001.jpg",
          "width": 1280,
          "height": 1920,
          "thumbnailWidth": 333,
          "thumbnailHeight": 500,
          "aspectRatio": 1.501502,
          "orientation": "portrait"
        },
        {
          "id": "photo-002",
          "title": "Photo 002",
          "thumbnail": "photos/wedding_small-002.jpg",
          "full": "photos/wedding_large-002.jpg",
          "width": 1280,
          "height": 1920,
          "thumbnailWidth": 333,
          "thumbnailHeight": 500,
          "aspectRatio": 1.501502,
          "orientation": "portrait"
        },
        {
          "id": "photo-003",
          "title": "Photo 003",
          "thumbnail": "photos/wedding_small-003.jpg",
          "full": "photos/wedding_large-003.jpg",
          "width": 1280,
          "height": 1920,
          "thumbnailWidth": 333,
          "thumbnailHeight": 500,
          "aspectRatio": 1.501502,
          "orientation": "portrait"
        },
        {
          "id": "photo-004",
          "title": "Photo 004",
          "thumbnail": "photos/wedding_small-004.jpg",
          "full": "photos/wedding_large-004.jpg",
          "width": 1920,
          "height": 1280,
          "thumbnailWidth": 500,
          "thumbnailHeight": 333,
          "aspectRatio": 0.666,
          "orientation": "landscape"
        },
        {
          "id": "photo-005",
          "title": "Photo 005",
          "thumbnail": "photos/wedding_small-005.jpg",
          "full": "photos/wedding_large-005.jpg",
          "width": 1280,
          "height": 1920,
          "thumbnailWidth": 333,
          "thumbnailHeight": 500,
          "aspectRatio": 1.501502,
          "orientation": "portrait"
        },
        {
          "id": "photo-006",
          "title": "Photo 006",
          "thumbnail": "photos/wedding_small-006.jpg",
          "full": "photos/wedding_large-006.jpg",
          "width": 1280,
          "height": 1920,
          "thumbnailWidth": 333,
          "thumbnailHeight": 500,
          "aspectRatio": 1.501502,
          "orientation": "portrait"
        },
        {
          "id": "photo-007",
          "title": "Photo 007",
          "thumbnail": "photos/wedding_small-007.jpg",
          "full": "photos/wedding_large-007.jpg",
          "width": 1280,
          "height": 1920,
          "thumbnailWidth": 333,
          "thumbnailHeight": 500,
          "aspectRatio": 1.501502,
          "orientation": "portrait"
        },
        {
          "id": "photo-008",
          "title": "Photo 008",
          "thumbnail": "photos/wedding_small-008.jpg",
          "full": "photos/wedding_large-008.jpg",
          "width": 1920,
          "height": 1280,
          "thumbnailWidth": 500,
          "thumbnailHeight": 333,
          "aspectRatio": 0.666,
          "orientation": "landscape"
        },
        {
          "id": "photo-009",
          "title": "Photo 009",
          "thumbnail": "photos/wedding_small-009.jpg",
          "full": "photos/wedding_large-009.jpg",
          "width": 1280,
          "height": 1920,
          "thumbnailWidth": 333,
          "thumbnailHeight": 500,
          "aspectRatio": 1.501502,
          "orientation": "portrait"
        },
        {
          "id": "photo-010",
          "title": "Photo 010",
          "thumbnail": "photos/wedding_small-010.jpg",
          "full": "photos/wedding_large-010.jpg",
          "width": 1280,
          "height": 1920,
          "thumbnailWidth": 333,
          "thumbnailHeight": 500,
          "aspectRatio": 1.501502,
          "orientation": "portrait"
        },
        {
          "id": "photo-011",
          "title": "Photo 011",
          "thumbnail": "photos/wedding_small-011.jpg",
          "full": "photos/wedding_large-011.jpg",
          "width": 1920,
          "height": 1280,
          "thumbnailWidth": 500,
          "thumbnailHeight": 333,
          "aspectRatio": 0.666,
          "orientation": "landscape"
        },
        {
          "id": "photo-012",
          "title": "Photo 012",
          "thumbnail": "photos/wedding_small-012.jpg",
          "full": "photos/wedding_large-012.jpg",
          "width": 1920,
          "height": 1280,
          "thumbnailWidth": 500,
          "thumbnailHeight": 333,
          "aspectRatio": 0.666,
          "orientation": "landscape"
        },
        {
          "id": "photo-013",
          "title": "Photo 013",
          "thumbnail": "photos/wedding_small-013.jpg",
          "full": "photos/wedding_large-013.jpg",
          "width": 1920,
          "height": 1280,
          "thumbnailWidth": 500,
          "thumbnailHeight": 333,
          "aspectRatio": 0.666,
          "orientation": "landscape"
        },
        {
          "id": "photo-014",
          "title": "Photo 014",
          "thumbnail": "photos/wedding_small-014.jpg",
          "full": "photos/wedding_large-014.jpg",
          "width": 1920,
          "height": 1280,
          "thumbnailWidth": 500,
          "thumbnailHeight": 333,
          "aspectRatio": 0.666,
          "orientation": "landscape"
        },
        {
          "id": "photo-015",
          "title": "Photo 015",
          "thumbnail": "photos/wedding_small-015.jpg",
          "full": "photos/wedding_large-015.jpg",
          "width": 1280,
          "height": 1920,
          "thumbnailWidth": 333,
          "thumbnailHeight": 500,
          "aspectRatio": 1.501502,
          "orientation": "portrait"
        },
        {
          "id": "photo-016",
          "title": "Photo 016",
          "thumbnail": "photos/wedding_small-016.jpg",
          "full": "photos/wedding_large-016.jpg",
          "width": 1280,
          "height": 1920,
          "thumbnailWidth": 333,
          "thumbnailHeight": 500,
          "aspectRatio": 1.501502,
          "orientation": "portrait"
        },
        {
          "id": "photo-017",
          "title": "Photo 017",
          "thumbnail": "photos/wedding_small-017.jpg",
          "full": "photos/wedding_large-017.jpg",
          "width": 1280,
          "height": 1920,
          "thumbnailWidth": 333,
          "thumbnailHeight": 500,
          "aspectRatio": 1.501502,
          "orientation": "portrait"
        },
        {
          "id": "photo-018",
          "title": "Photo 018",
          "thumbnail": "photos/wedding_small-018.jpg",
          "full": "photos/wedding_large-018.jpg",
          "width": 1920,
          "height": 1280,
          "thumbnailWidth": 500,
          "thumbnailHeight": 333,
          "aspectRatio": 0.666,
          "orientation": "landscape"
        },
        {
          "id": "photo-019",
          "title": "Photo 019",
          "thumbnail": "photos/wedding_small-019.jpg",
          "full": "photos/wedding_large-019.jpg",
          "width": 1280,
          "height": 1920,
          "thumbnailWidth": 333,
          "thumbnailHeight": 500,
          "aspectRatio": 1.501502,
          "orientation": "portrait"
        },
        {
          "id": "photo-020",
          "title": "Photo 020",
          "thumbnail": "photos/wedding_small-020.jpg",
          "full": "photos/wedding_large-020.jpg",
          "width": 1280,
          "height": 1920,
          "thumbnailWidth": 333,
          "thumbnailHeight": 500,
          "aspectRatio": 1.501502,
          "orientation": "portrait"
        },
        {
          "id": "photo-021",
          "title": "Photo 021",
          "thumbnail": "photos/wedding_small-021.jpg",
          "full": "photos/wedding_large-021.jpg",
          "width": 1280,
          "height": 1920,
          "thumbnailWidth": 333,
          "thumbnailHeight": 500,
          "aspectRatio": 1.501502,
          "orientation": "portrait"
        },
        {
          "id": "photo-022",
          "title": "Photo 022",
          "thumbnail": "photos/wedding_small-022.jpg",
          "full": "photos/wedding_large-022.jpg",
          "width": 1920,
          "height": 1280,
          "thumbnailWidth": 500,
          "thumbnailHeight": 333,
          "aspectRatio": 0.666,
          "orientation": "landscape"
        },
        {
          "id": "photo-023",
          "title": "Photo 023",
          "thumbnail": "photos/wedding_small-023.jpg",
          "full": "photos/wedding_large-023.jpg",
          "width": 1280,
          "height": 1920,
          "thumbnailWidth": 333,
          "thumbnailHeight": 500,
          "aspectRatio": 1.501502,
          "orientation": "portrait"
        },
        {
          "id": "photo-024",
          "title": "Photo 024",
          "thumbnail": "photos/wedding_small-024.jpg",
          "full": "photos/wedding_large-024.jpg",
          "width": 1280,
          "height": 1920,
          "thumbnailWidth": 333,
          "thumbnailHeight": 500,
          "aspectRatio": 1.501502,
          "orientation": "portrait"
        },
        {
          "id": "photo-025",
          "title": "Photo 025",
          "thumbnail": "photos/wedding_small-025.jpg",
          "full": "photos/wedding_large-025.jpg",
          "width": 1280,
          "height": 1920,
          "thumbnailWidth": 333,
          "thumbnailHeight": 500,
          "aspectRatio": 1.501502,
          "orientation": "portrait"
        },
        {
          "id": "photo-026",
          "title": "Photo 026",
          "thumbnail": "photos/wedding_small-026.jpg",
          "full": "photos/wedding_large-026.jpg",
          "width": 1280,